index,question,expected,answer,time_total_sec,num_hits,judge_relevance,judge_completeness,judge_helpfulness,judge_clarity,judge_hallucination_risk,judge_overall_score,judge_justification
1,"В каком разделе заявитель может написать менеджеру ЛК, при возникновении вопросов по работе с ЛК ?",Мои письма,"Заявитель может написать менеджеру личного кабинета в разделе **«Мои письма»**. **Как это сделать** 1. Войдите в личный кабинет на сайте www.bashkirenergo.ru. 2. В меню выберите пункт **«Мои письма»**. 3. Нажмите кнопку **«Новое письмо»** (зелёную кнопку). 4. Укажите тип обращения (вопрос, жалоба, прочее), коротко сформулируйте тему и опишите проблему в поле сообщения. 5. При необходимости приложите файлы и нажмите **«Создать»**. После отправки письма менеджер ЛК получит запрос и ответит в том же разделе, где будет отображено уведомление «новое сообщение!». **Дополнительные условия** - Доступ к разделу «Мои письма» возможен только после активации личного кабинета (логин / пароль). - Ответ менеджера приходит в виде сообщения в этом же разделе; при получении нового сообщения появляется индикатор «новое сообщение!». Если возникнут трудности с отправкой письма, можно обратиться в клиентский сервис по телефону 8‑800‑234‑77‑00 или в Центр обслуживания клиентов. *Информация взята из инструкций по работе в личном кабинете, где описан процесс обмена сообщениями с менеджером ЛК [1][2].*",26.123,2,5,5,5,5,4,4.8,"Ответ полностью отвечает на вопрос, указывая точный раздел «Мои письма», и дополнительно предоставляет пошаговые инструкции, условия доступа и альтернативные контакты, что делает его исчерпывающим и полезным. Текст ясно структурирован и легко воспринимается. Информация соответствует характеру инструкций, хотя в исходных источниках не указано явно название раздела, поэтому риск галлюцинаций оценивается как низкий, но не нулевой."
2,В каком разделе заявитель может ознакомиться с размещенными документами по заявке ?,Мои документы,"Заявитель может ознакомиться с документами, размещёнными по его заявке, в **Личном кабинете** на сайте www.bashkirenergo.ru в разделе «Личный кабинет потребителя услуг по технологическому присоединению» [2][1]. **Как это сделать** 1. Перейдите на сайт www.bashkirenergo.ru и нажмите кнопку «Личный кабинет». 2. Войдите, используя выданные логин и пароль (при их отсутствии зарегистрируйтесь). 3. В личном кабинете откройте раздел «Технологическое присоединение к электросетям» → «Документы заявки». 4. Там будут размещены типовой договор, счёт, уведомления и прочие документы, связанные с вашей заявкой. **Дополнительные условия** - Доступ к документам появляется в течение 10 рабочих дней после поступления заявки. - Для просмотра требуется активный личный кабинет; при его отсутствии его необходимо создать в офисе или онлайн. **Что делать дальше** Если возникнут трудности с доступом к документам, обратитесь в клиентский сервис по телефону 8‑800‑234‑77‑00 или посетите Центр обслуживания клиентов по адресу г. Уфа, ул. Комсомольская, 17. Мы поможем открыть личный кабинет и получить нужные файлы.",20.908,2,5,5,5,5,3,4.6,"Ответ полностью отвечает на вопрос, указывая конкретный раздел и предоставляя пошаговые инструкции, что делает его очень полезным и ясным. Однако часть деталей (например, сроки доступа, контактный телефон) не явно подтверждена приведёнными источниками, что повышает риск галлюцинаций."
3,В каком разделе заявитель может откорректировать свои личные данные ?,Мои данные,"Заявитель может откорректировать свои личные данные в разделе **«Мои данные»** личного кабинета. **Пошаговая инструкция** 1. Войдите в личный кабинет на сайте www.bashkirenergo.ru. 2. Перейдите в раздел «Мои данные». 3. Нажмите кнопку «Изменить данные» (или отдельные кнопки для изменения логина, пароля, e‑mail). 4. Введите актуальные значения в соответствующие поля и при необходимости прикрепите сканы документов. 5. Подтвердите изменения, нажав «Сохранить»/«Отправить». После отправки данные проверяются менеджером ЛК в течение одного рабочего дня. Эти действия описаны в инструкциях по работе в личном кабинете [1][2]. Если возникнут трудности, обратитесь в клиентский сервис по телефону 8‑800‑234‑77‑00.",26.18,2,5,5,5,5,5,5.0,"Ответ точно указывает нужный раздел «Мои данные», полностью раскрывает вопрос и предоставляет полезные пошаговые инструкции. Текст ясен и хорошо структурирован, а информация согласуется с указанными источниками, без придуманных деталей."
4,В течении какого срока менеджер ЛК производит проверку данных заявителя после регистрации Личного кабинета.,1 рабочий день,"После завершения регистрации личного кабинета менеджер проверяет предоставленные заявителем данные в течение одного рабочего дня. В этот период в кабинете отображается сообщение о блокировке изменения данных и невозможности подачи новых заявок. По окончании проверки данные становятся доступными для редактирования, а возможность создания новых документов разблокируется [3][1][2]. **Пошаговая инструкция** 1. Заполните регистрационную форму и загрузите сканы необходимых документов. 2. Ожидайте проверку – менеджер осуществит её в течение 1 рабочего дня. 3. После завершения проверки в разделе «Мои данные» исчезнет сообщение о блокировке, и вы сможете изменить сведения или подать заявку на технологическое присоединение. Если в течение рабочего дня вы не получили подтверждения о завершении проверки, рекомендуется проверить раздел «Мои письма» на наличие уведомления о замечаниях и при необходимости исправить данные [1][2]. При возникновении вопросов обращайтесь в клиентский сервис по телефону 8‑800‑234‑77‑00.",26.25,3,5,5,5,5,5,5.0,"Ответ полностью отвечает на вопрос о сроке проверки (один рабочий день) и дополнительно предоставляет полезные инструкции и контактную информацию. Информация согласуется с указанными источниками, изложена ясно и структурированно, без вымышленных деталей."
5,Для чего требуется подтверждение личности?,"Для возможности подписывать документы (договор, доп. соглашения и акты) через ЛК, посредствам ЭЦП.","Подтверждение личности требуется только для физических лиц и только для возможности подписания ими документов (договоров, дополнительных соглашений) простой электронной подписью ЭП) путём ввода кода, полученного по СМС [1]. Это подтверждение необходимо, если заявитель планирует использовать простую ЭП — например, при подписании документов в рамках полной процедуры технологического присоединения. Для подачи заявки на ТП или для подписания документов квалифицированной электронной подписью подтверждение личности не требуется [1][2]. Если требуется использовать простую ЭП, заявитель должен подтвердить личность, посетив любой пункт обслуживания и подав отдельное заявление с указанием телефона, на который будут приходить коды подтверждения [2].",26.214,2,4,4,4,4,5,4.2,"Ответ непосредственно раскрывает цель подтверждения личности — возможность использования простой электронной подписи, и указывает, что для квалифицированной подписи оно не требуется. Приведены практические шаги для получения подтверждения, что повышает полезность. Текст ясен и логично построен, хотя местами мог бы быть более лаконичным. Информация соответствует указанным источникам, вымышленных данных нет, поэтому риск галлюцинаций низкий."
6,"Есть ли необходимость регистрировать Личный кабинет, если заявку на ТП подавали очно в ЦОК?","Нет, при подачи заявки очно в ЦОК, сотрудник ОРПУ регистрирует Личный кабинет и выдает заявителю логин и временный пароль.","**Ответ** Регистрация личного кабинета не обязательна для подачи заявки на технологическое присоединение, если она подаётся лично в центр обслуживания (ЦОК). В офисах ООО «Башкирэнерго» можно подать полностью оформленную заявку без наличия аккаунта [1]. Однако после подачи заявки все последующие документы (технические условия, счёт, инструкция) размещаются в личном кабинете, а возможность их просмотра и дальнейшего взаимодействия (например, подписания договора) требует наличия зарегистрированного пользователя [2]. Поэтому, если вы хотите получать и контролировать документы онлайн, рекомендуется пройти регистрацию в личном кабинете после личного обращения. **Пошаговая инструкция** 1. **Соберите пакет документов** — паспорт, сведения о объекте, технические параметры и т.п. [1] 2. **Подайте заявку лично** в ЦОК (офис ООО «Башкирэнерго») — это допускается без личного кабинета [1]. 3. **(Опционально) Зарегистрируйте личный кабинет** на сайте www.bashkirenergo.ru, чтобы получать в нём размещённые документы и сообщения от сетевой организации [2]. 4. После регистрации менеджер проверит предоставленные данные в течение 1 рабочего дня [2]; в кабинете появятся договор, счёт и инструкция. **Дополнительные условия** - Если вы не регистрируетесь, получите документы в бумажном виде в офисе, но онлайн‑доступ к ним будет недоступен. - При необходимости подписания договора простой электронной подписью (ЭП) требуется подтверждение личности [3], что также удобно выполнять через личный кабинет. **Рекомендация** Если вам важен быстрый доступ к документам и возможность подписания их в электронном виде, оформите личный кабинет после личного обращения. При возникновении вопросов обращайтесь в клиентский сервис по телефону 8‑800‑234‑77‑00.",8.239,3,5,5,5,5,4,4.8,"Ответ полностью отвечает на вопрос о необходимости регистрации личного кабинета, раскрывает последствия и даёт практические рекомендации. Информация представлена в структурированном виде, что повышает её полезность и ясность. Большая часть утверждений опирается на предоставленные источники, хотя отдельные детали (например, сроки проверки менеджера) могут быть уточнены, поэтому риск галлюцинаций оценивается как низкий, но не нулевой."
7,Есть ли у потребителя возможность изменить e-mail в личных данных заявителя?,"Да есть, в разделе Мои данные заявитель может изменить e-mail.","Да, потребитель может изменить e‑mail в разделе «Мои данные» личного кабинета заявителя. **Как это сделать** 1. Войдите в личный кабинет на сайте www.bashkirenergo.ru. 2. Откройте раздел **«Мои данные»**. 3. Нажмите кнопку **«Изменить»** рядом с полем e‑mail. 4. Введите новый адрес электронной почты и подтвердите изменение, нажав **«Изменить данные»**. 5. Система отправит письмо‑подтверждение на указанный новый e‑mail; перейдите по ссылке в письме, чтобы завершить изменение. **Что происходит после изменения** - После отправки запроса данные проверяются менеджером личного кабинета в течение 1 рабочего дня [1]. - Если данные корректны, в кабинете появятся обновлённые контактные сведения, и пользователь получит доступ к дальнейшему электронному взаимодействию (получение документов, подписания договоров и т.п.). **Дополнительные условия** - При изменении e‑mail необходимо иметь готовые сканы подтверждающих документов (паспорт, СНИЛС) в случае, если менеджер потребует их для проверки [1]. - Пока данные находятся в проверке, изменение невозможно и новые заявки не принимаются [1]. Если возникнут вопросы или понадобится помощь при изменении e‑mail, обратитесь в клиентский сервис «Башкирэнерго» по телефону 8‑800‑234‑77‑00.",27.457,1,5,5,5,5,4,4.8,"Ответ полностью отвечает на вопрос о возможности изменения e‑mail, предоставляет подробные пошаговые инструкции, дополнительные условия и контактные данные, что делает его очень полезным и ясным. Информация в основном соответствует указанному источнику, хотя некоторые детали могут быть добавлены без прямой ссылки, поэтому риск галлюцинаций оценивается как низкий, но не нулевой."
8,"Заявитель обращается в КЦ при заполнении заявки на ТП через ЛК и уточняет как указать адрес объекта, если улица и дом еще не присвоены? Действия оператора.","Оператор рекомендует указать адрес объекта так, как указано в документах на собственность. Если улица и номер дома еще не присвоен можно поставить 0 (ноль) или написать слово «нет». Закрывает обращение на 1-ой линии.","**Ответ оператора** При заполнении заявки на технологическое присоединение в личном кабинете необходимо указать адрес объекта в разделе «Местонахождение объекта». 1. **Улица** – введите название улицы, указанное в документах на собственность (договоре купли‑продажи, выписке из реестра и т.п.). 2. **Дом** – если номер дома ещё не присвоен, в поле «номер дома» укажите `0` (ноль) или напишите слово **«нет»** [1]. Таким образом, заявка будет принята, а дальнейшая проверка данных будет проведена менеджером личного кабинета. **Пошаговая инструкция для оператора** 1. Попросите заявителя открыть личный кабинет → раздел «Мои данные» → кнопку «Создать заявку». 2. Укажите, что в поле «Улица» следует ввести название улицы из официальных документов. 3. Сообщите, что если номер дома не присвоен, необходимо ввести `0` или слово «нет» [1]. 4. При необходимости уточните, есть ли у заявителя подтверждающие документы (право собственности) и предложите их загрузить в приложение к заявке. 5. Подтвердите, что после отправки заявки менеджер проверит данные в течение 1 рабочего дня и свяжется с заявителем при необходимости. **Дополнительные условия** - Адрес, указанный в заявке, должен полностью соответствовать данным, указанным в документах на собственность. - При отсутствии номера дома заявитель может использовать `0` или «нет», однако остальные элементы адреса (город, улица, корпус, строение, квартира) обязаны быть заполнены. Если у заявителя возникнут вопросы или понадобится помощь, он может обратиться в клиентский сервис «Башкирэнерго» по телефону 8‑800‑234‑77‑00. Будем рады помочь в дальнейшем!",27.273,1,5,5,5,5,5,5.0,"Ответ полностью соответствует вопросу, охватывает все необходимые детали, дает чёткие пошаговые инструкции оператору, структурирован и понятен. Информация опирается на указанный источник, без вымышленных данных."
