index,question,expected,answer,time_total_sec,num_hits,judge_relevance,judge_completeness,judge_helpfulness,judge_clarity,judge_hallucination_risk,judge_overall_score,judge_justification
51,"В КЦ обращается потребитель с вопросом\: ""Есть ли необходимость подписания и возврата доп. соглашения на изменение сроков подключения по договору на дополнительные услуги?»",Дополнительное соглашение необходимо подписать и вернуть в СО.,"Подписание и возврат отдельного дополнительного соглашения – на изменение сроков подключения по договору на дополнительные услуги не требуются. Для заявителей (ФЛ, ИП, ЮЛ) процесс оформления технологического присоединения регулируется основным договором и техническими условиями. После того как заявитель оплатит выставленный счёт, договор считается заключённым без необходимости подписывать отдельный документ – это указано в FAQ по договору на технологическое присоединение [3]. Если возникнет необходимость изменить сроки подключения, заявителю достаточно обратиться в клиентский сервис или в центр обслуживания, уточнить требуемый перенос и согласовать его с сетевой организацией. Сетевая организация в течение 3 рабочих дней должна предоставить информацию о стоимости и, при необходимости, направить оферту на заключение договора, но отдельного «доп. соглашения» в этом случае не требуется – это отражено в обязанностях сторон, где указано, что все изменения и согласования фиксируются в рамках основного договора и технических условий [1][2]. **Пошаговая инструкция** 1. Свяжитесь с клиентским сервисом (8‑800‑234‑77‑00) или подайте заявку в личном кабинете –ashkirenergo.ru. 2. Укажите требуемый перенос сроков подключения и предоставьте необходимые сведения. 3. Ожидайте уведомления от сетевой организации (в течение 3 рабочих дней) о согласовании изменения и, при необходимости, о стоимости. 4. При получении подтверждения изменения сроков подпишите и верните только основной договор/технические условия, если этого требует процедура; отдельного дополнительного соглашения подписывать не нужно. **Дополнительные условия** - Для ФЛ до 15 кВт действуют льготные тарифы, для ИП и ЮЛ – нет. - Все документы (технические условия, договор) могут быть оформлены в электронном виде и размещены в личном кабинете. Если понадобится уточнить детали или оформить заявку, обратитесь в клиентский сервис – операторы помогут согласовать изменения и подготовить необходимые документы.",24.712,3,4,4,4,5,4,4.2,"Ответ в основном соответствует вопросу и дает чёткое отрицание необходимости подписания отдельного соглашения, а также практические шаги для изменения сроков подключения. Информация достаточна, хотя часть деталей (например, ссылки на FAQ и юридические положения) может быть более точно привязана к источникам. Текст хорошо структурирован и легко воспринимается. Риск выдуманных деталей умеренный, так как некоторые утверждения не явно подтверждены указанными источниками."
52,"В случае если заявитель не явился в назначенный срок или подготовил материал, не соответствующий ТУ – какую сумму составит повторный выезд бригады?",6 000 руб.,"Повторный выезд бригады за несвоевременное прибытие заявителя или за предоставление материалов, не соответствующих техническим условиям, не имеет фиксированной суммы в представленных нормативных актах и тарифных таблицах. Стоимость такой услуги определяется индивидуально в зависимости от объёма работ и конкретных условий подключения. **Что сделать:** 1. Свяжитесь с клиентским сервисом «Башкирэнерго» по телефону 8‑800‑234‑77‑00 или посетите центр обслуживания (г. Уфа, ул. Комсомольская, 17). 2. Уточните у специалиста детали вашего случая (мощность подключения, причина несоответствия ТУ, необходимость повторного выезда). 3. Получите расчёт стоимости и реквизиты для оплаты. **Дополнительные документы, которые могут потребоваться:** - Технические условия (ТУ), выданные сетевой организацией. - Заявление на технологическое присоединение (если ещё не подано). **Контакт для уточнения:** клиентский сервис — 8‑800‑234‑77‑00, центр обслуживания — г. Уфа, ул. Комсомольская, 17. Если понадобится помощь с подготовкой документов или разъяснением дальнейших этапов подключения, будем рады помочь.",17.422,5,4,3,4,5,3,3.8,"Ответ затрагивает тему вопроса, объясняя, что фиксированной суммы нет, и предлагает конкретные действия (контакты, уточнение деталей). Однако он не предоставляет конкретную цифру, что делает его неполным по запросу. Информация представлена ясно и структурировано, но часть утверждений о отсутствии фиксированной суммы не явно подтверждена приведёнными источниками, поэтому риск галлюцинаций умеренный."
53,В течении какого времени заявитель обязан оплатить счет по договору дополнительных услуг?,В течении 5 рабочих дней.,"Заявитель обязан оплатить выставленный счёт в течение 5 рабочих дней со дня его получения. Если оплата не произведена в указанный срок, заявка считается аннулированной [1][2][4][3]. **Дополнительные детали** - Счёт формируется после направления документов в личный кабинет (условия типового договора, технические условия, уведомление). - При неоплате в течение 5 рабочих дней заявка аннулируется, а гарантирующий поставщик уведомляется о прекращении рассмотрения [1][2]. - При оплате счёт считается подтверждением заключения договора; отдельного подписания основного договора не требуется [1][3]. Если требуется уточнить порядок оплаты или получить реквизиты, обратитесь в клиентский сервис — операторы помогут оформить платёж и ответить на дополнительные вопросы.",24.778,4,5,5,5,5,4,4.8,"Ответ полностью отвечает на вопрос о сроке оплаты, указывает точный период (5 рабочих дней) и последствия несвоевременной оплаты, а также даёт практические рекомендации. Информация представлена ясно и структурировано. Ссылается на несколько источников, что снижает риск выдумок, однако без проверки их содержания некоторый риск галлюцинаций остаётся, поэтому оценка риска 4."
54,В течении какого времени инженер ОПП выезжает на объект для определения возможности оказания Дополнительных услуг?,"В течении 3 рабочих дней, после подачи обращения на ДУ.","**Ответ** Инженер ОПП выезжает на объект в течение 5 рабочих дней с момента согласования даты и времени выезда. Если запрос считается срочным, выезд осуществляется в тот же день – уведомление о времени прибытия делается непосредственно перед выездом [1]. **Пошаговая инструкция** 1. Обратитесь в клиентский сервис или в центр обслуживания и уточните необходимость дополнительной услуги. 2. Согласуйте с сетевой организацией удобную дату и время выезда инженера ОПП. 3. Ожидайте уведомления: - обычный запрос – уведомление будет получено не позже, чем за 5 рабочих дней до планируемого выезда; - срочный запрос – уведомление придёт непосредственно перед выездом. 4. В согласованную дату и время инженер прибудет на объект для оценки возможности оказания дополнительной услуги. **Дополнительные условия / документы** - Для подачи заявки используйте форму «Заявление на платные услуги» (см. паспорт услуги [2]). - При необходимости уточните детали в личном кабинете www.bashkirenergo.ru или по телефону 8‑800‑234‑77‑00. **Призыв к действию** Если требуется уточнение сроков или оформление заявки, свяжитесь с клиентским сервисом «Башкирэнерго» — операторы помогут согласовать выезд инженера ОПП и подготовить необходимые документы.",20.811,2,5,5,5,5,4,4.8,"Ответ полностью отвечает на вопрос о сроках выезда инженера ОПП, указывая 5 рабочих дней и возможность выезда в тот же день при срочном запросе. Кроме того, предоставлены практические шаги и контактные данные, что делает ответ очень полезным. Текст ясно структурирован, разделён на блоки, что повышает читаемость. Информация в значительной степени опирается на указанные источники, хотя некоторые детали (процесс согласования, формы заявки) могут быть добавлены без прямой ссылки, поэтому риск галлюцинаций оценивается как низкий, но не нулевой."
55,Договор на ДУ является заключенным с момента?,С момента поступления денежных средств на р/с ООО\n«Башкирэнерго».,"Договор на дополнительные услуги (договор на технологическое присоединение) считается заключённым с дня оплаты заявителем выставленного счета на оплату технологического присоединения [1][2][3][4]. После фактической оплаты счёта статус договора считается действующим без необходимости подписания отдельного документа. Если понадобится уточнить детали или оформить оплату, обратитесь в клиентский сервис — операторы помогут подготовить и оплатить счёт.",24.745,4,5,5,5,5,5,5.0,"Ответ полностью отвечает на вопрос, предоставляя точную информацию о моменте заключения договора, полностью раскрывает тему, полезен и ясен. Информация соответствует предоставленным источникам, без выдумок."
56,Должен ли инженер ОПП СО оказывать консультацию по инструкции на самостоятельное фактическое присоединение?,В обязанности СО не входит консультация заявителей по самостоятельному\nфактическому присоединению.,"**Ответ** Согласно имеющимся документам, обязанность инженера отдела присоединения (ОПП СО) по обязательному консультированию заявителя по инструкции самостоятельного фактического присоединения не установлена. Инструкция и порядок присоединения регламентируются правилами технологического присоединения, а при необходимости разъяснений заявителю предлагается обращаться в клиентский сервис — операторы помогают согласовать изменения и подготовить документы [2][3][1]. **Пошаговая рекомендация** 1. Ознакомьтесь с инструкцией по самостоятельному фактическому присоединению, размещённой в личном кабинете [2]. 2. При возникновении вопросов обратитесь в клиентский сервис (тел. 8‑800‑234‑77‑00) [1]. 3. При необходимости получения дополнительных платных услуг (например, отключения линии) оформите заявку в Центре обслуживания клиентов [1]. **Дополнительные условия** - Все работы по фактическому присоединению должны выполняться квалифицированным электротехническим персоналом [3][1]. - Сетевая организация (СО) предоставляет только общие сведения о порядке работ и уведомляет о датах отключения, но консультация по самой инструкции не входит в её обязательства [1]. **Призыв к действию** Если требуется разъяснение пунктов инструкции или помощь в оформлении заявки, позвоните в клиентский сервис — операторы помогут вам быстро и корректно решить вопрос. При необходимости дополнительной помощи дайте знать.",15.56,3,5,5,5,5,4,4.8,"Ответ полностью отвечает на вопрос о том, обязан ли инженер ОПП СО консультировать по инструкции, и приводит аргументированное объяснение с рекомендациями и контактными данными. Информация структурирована, легко воспринимается и полезна для пользователя. Риск галлюцинаций низок, так как большинство утверждений опираются на указанные источники, хотя некоторые выводы (о отсутствии обязательств) могут быть сделаны на основе интерпретации, а не прямой цитаты."
57,Если у заявителя нет объекта ТП (земельный участок без построек) сможет ли он подать заявку на ДУ пакет «ТП под ключ»?,"Да, в случае если установит трубостойку, соответствующую требованиям электромонтажа до проведения обследования инженера ОПП.","Согласно правилам технологического присоединения, работы по строительству объектов электросетевого хозяйства осуществляются только до границы земельного участка заявителя [1]. Пакет «ТП под ключ» включает такие операции, как установка распределительного щита и автоматических выключателей на фасаде объекта, монтаж отведения от шкафа учёта до вводного распределительного устройства, а также фактическое присоединение к сетям [2]. Всё это предполагает наличие строительного объекта (фасада) и энергопринимающих устройств, к которым будет выполнено подключение. Если у заявителя есть только земельный участок без построек и без энергопринимающих устройств, условия для выполнения указанных в пакете работ не выполнены. Поэтому оформить заявку на пакет «ТП под ключ» нельзя; можно лишь воспользоваться услугами, предусмотренными в пункте 25 Правил ТП, которые охватывают строительство до границы участка [1]. **Итого:** заявитель без построенного объекта не может подать заявку на пакет «ТП под ключ». Для получения этой услуги необходимо наличие здания (фасада) и энергопринимающих устройств, которые будут подключены. При необходимости уточнить возможные варианты подключения рекомендуется обратиться в клиентский сервис — операторы помогут подобрать подходящие услуги [1][2].",11.411,2,5,5,5,5,5,5.0,"Ответ полностью отвечает на вопрос, объясняя, что без построенного объекта подать заявку на пакет «ТП под ключ» нельзя, и приводит ссылки на нормативные документы. Информация представлена чётко, структурировано и полезна, с рекомендацией обратиться в сервис. Нет признаков выдумок, всё основано на указанных источниках."
58,"Есть ли возможность подать заявку на ДУ в случае, если заявку подает ФЛ 20 кВт?","Да, можно.","**Ответ:** Физическое лицо может подать заявку на технологическое присоединение только для энергопринимающих устройств с максимальной мощностью до 15 кВт включительно [1]. При мощности 20 кВт такой заявки в форме для ФЛ не существует; для объектов с мощностью свыше 15 кВт необходимо оформлять заявку как индивидуальный предприниматель или юридическое лицо [3][2]. **Что делать:** 1. **Преобразовать статус** – зарегистрироваться как ИП (если вы планируете использовать объект в предпринимательской деятельности) или оформить юридическое лицо. 2. **Подготовить заявку** согласно образцу для ИП/ЮЛ, указав требуемую мощность 20 кВт и все обязательные реквизиты [3][2]. 3. **Отправить заявку** в сетевую организацию через личный кабинет, центр обслуживания или контакт‑центр [1]. 4. **Ожидать расчёта стоимости** и подготовки технической схемы присоединения (при необходимости – согласование схемы выдачи мощности). **Дополнительные условия:** - Льготные тарифы предоставляются только ФЛ до 15 кВт; для 20 кВт они не действуют [1]. - Техническое присоединение к более 150 кВт осуществляется силами сетевой организации, но в вашем случае мощность 20 кВт не превышает этот порог [2]. **Рекомендация:** Если вы хотите подключить объект мощностью 20 кВт, обратитесь в клиентский сервис Башкирэнерго (тел. 8‑800‑234‑77‑00) для уточнения процедуры регистрации в ИП/ЮЛ и получения полного перечня необходимых документов [1]. Готовы помочь с дальнейшими вопросами – дайте знать!",23.794,3,5,5,5,5,5,5.0,"Ответ полностью отвечает на вопрос, раскрывает все детали, предоставляет конкретные шаги и рекомендации, изложен ясно и структурировано, информация опирается на указанные источники без видимых выдумок."
