index,question,expected,answer,time_total_sec,num_hits,judge_relevance,judge_completeness,judge_helpfulness,judge_clarity,judge_hallucination_risk,judge_overall_score,judge_justification
27,"Какой вид заявки в ЛК выбирается в случае подачи заявки на платные услуги ""ТПП под ключ""?",Заявка на платные услуги,"Для получения платных услуг «ТП под ключ» в личном кабинете необходимо оформить **«Заявление на оказание платных услуг по технологическому присоединению»** — тип заявки, который находится в разделе «Заявления на ТП» [2][1]. **Пошаговая инструкция** 1. Войдите в личный кабинет и откройте раздел **«Мои документы»**. 2. Нажмите кнопку **«Новый документ»**. 3. В открывшемся окне перейдите на вкладку **«Заявления на ТП»**. 4. Выберите пункт **«Заявление на оказание платных услуг по технологическому присоединению»** (это первый пункт в списке, соответствующий платным услугам). 5. Нажмите **«Создать»** и заполните обязательные поля (данные о заявителе, объекте, мощности, перечень требуемых услуг и т.п.). 6. Прикрепите необходимые сканы документов и отправьте заявку. После отправки заявка будет рассмотрена сетевой организацией, и вам будет предоставлен расчёт стоимости услуги «ТП под ключ» и дальнейшие инструкции по заключению договора. Если понадобится помощь при заполнении или уточнение деталей, обращайтесь в клиентский сервис ООО «Башкирэнерго» по телефону 8‑800‑234‑77‑00.",21.24,2,5,5,5,5,5,5.0,"Ответ точно указывает нужный тип заявки и дополнительно предоставляет подробную инструкцию по её оформлению, что делает его полностью релевантным, полным, полезным и ясным. Информация согласуется с приведёнными источниками, без вымышленных деталей, поэтому риск галлюцинаций минимален."
28,Какой вид заявки в ЛК выбирается в случае подключения объекта недвижимости путем перераспределения мощности от другого подключенного объекта недвижимости ?,Обращение на перераспределение мощности,"В предоставленных документах не указано, какой именно тип заявки в личном кабинете следует выбрать для подключения объекта недвижимости путём перераспределения мощности от другого подключённого объекта. Для уточнения процедуры рекомендуется обратиться в клиентский сервис «Башкирэнерго» по телефону 8‑800‑234‑77‑00 или воспользоваться справочной информацией в личном кабинете.",21.256,5,3,2,2,4,5,3.2,"Ответ касается вопроса, но лишь указывает, что в доступных документах нет информации о типе заявки, и предлагает обратиться в сервис. Поэтому релевантность умеренная, полнота и полезность низкие, так как не предоставлен конкретный тип заявки. Текст ясен и структурирован, а информация не содержит вымышленных данных, что снижает риск галлюцинаций."
29,Какой вид заявки в ЛК выбирается в случае увеличения мощности ранее подключенного объекта недвижимости ?,Обращение на увеличение мощности,"Для увеличения мощности уже подключённого объекта недвижимости в личном кабинете необходимо оформить **«Обращение на увеличение мощности»**. **Как подать заявку:** 1. Войдите в личный кабинет — раздел **«Мои документы»**. 2. Нажмите кнопку **«Новый документ»**. 3. В открывшемся окне переключитесь на вкладку **«Обращения на изменение ТП»** (это раздел, где находятся корректирующие обращения к уже существующим подключениям). 4. В списке выберите пункт **«Обращение на увеличение мощности»**. 5. Заполните обязательные поля (данные заявителя, объект, текущая и запрашиваемая мощность, контактная информация). 6. Прикрепите требуемые сканы документов (технические условия, акт ТП и др.) и отправьте заявку. После отправки заявка будет рассмотрена сетевой организацией, и вам будет предоставён расчёт стоимости и дальнейшие инструкции по заключению договора. *Список видов заявок, включая «Обращение на увеличение мощности», указан в руководстве по работе в ЛК [1].* Если понадобится помощь при заполнении или уточнение деталей, обращайтесь в клиентский сервис ООО «Башкирэнерго» по телефону 8‑800‑234‑77‑00.",21.151,1,5,5,5,5,5,5.0,"Ответ полностью соответствует вопросу, указывает точный тип заявки «Обращение на увеличение мощности» и подробно описывает порядок её подачи, включая необходимые документы и контактную информацию. Информация согласуется с указанным источником, не содержит вымышленных деталей. Текст ясен, логически структурирован и полезен для пользователя."
30,Может ли заявитель приложить недостающие документы к заявке через ЛК?,"Да может, в разделе Мои Документы --> Электронные документы --> кнопка ""Приложить недостающие документы""","Да, заявитель может добавить недостающие документы к уже поданной заявке через Личный кабинет (ЛК). **Как это делается** 1. После подачи заявки система проверяет комплект документов. Если чего‑то не хватает, в течение 3 рабочих дней заявителю приходит SMS‑сообщение о неполном пакете [2]. 2. В ЛК в разделе **«Мои документы»** появляется уведомление **«Предоставлен не полный пакет документов. Ожидание недостающих документов от заявителя»** [1]. 3. Откройте это уведомление в подразделе **«Электронные документы»** – в нём указано, какие именно документы отсутствуют [2]. 4. Появится кнопка **«Прикрепить файлы и отправить повторно»**. Нажмите её, загрузите сканы недостающих документов и подтвердите отправку [1][2]. 5. После получения новых файлов заявка будет вновь проверена специалистами сетевой организации [1]. **Важно** - Кнопка «Прикрепить файлы и отправить повторно» появляется только после того, как компания разместит уведомление о недостающих документах; до этого загрузить файлы самостоятельно невозможно [1]. - Если уведомление не появилось в течение 1‑2 дней после SMS, рекомендуется подождать, а в случае задержки обратиться в центр обслуживания или в клиентский сервис [3][2]. Таким образом, недостающие документы можно приложить к заявке через ЛК, но только после получения официального уведомления от ООО «Башкирэнерго». При возникновении затруднений свяжитесь с поддержкой по телефону 8‑800‑234‑77‑00.",21.114,3,5,5,5,5,4,4.8,"Ответ полностью отвечает на вопрос, предоставляет детальные пошаговые инструкции и дополнительную информацию о необходимости уведомления и обращения в поддержку. Текст чётко структурирован, легко воспринимается. Информация в основном опирается на указанные источники, однако некоторые детали (например, сроки SMS) могут быть менее явно подтверждены, что слегка повышает риск галлюцинаций."
31,Можно ли через ЛК подать недостающие к документы к «Обращению»?,"Нет, недостающие документы к ""Обращению"" можно подать только очно в ЦОК/ПОК.","Да, недостающие к документ к «Обращению» можно загрузить через личный кабинет на сайте www.bashkirenergo.ru. **Как это сделать** 1. Войдите в личный кабинет, используя официальную ссылку https://www.bashkirenergo.ru/ [3]. 2. Перейдите в раздел «Технологическое присоединение» → «Обращения» (или в раздел, где находится ваша заявка). 3. Откройте конкретное обращение и нажмите кнопку «Добавить/загрузить документы». 4. Прикрепите скан‑копии недостающих документов и подтвердите загрузку. 5. После успешной отправки вы получите подтверждающее сообщение (SMS или уведомление в ЛК). **Дополнительные условия** - Если в течение 20 рабочих дней после уведомления о недостатке документов вы не загрузите их, заявка будет приостановлена [1][2]. - Помимо загрузки в ЛК, документы можно предоставить лично в офисе или отправить почтой [1][2]. Если возникнут трудности с загрузкой, обратитесь в клиентский сервис 8‑800‑234‑77‑00 для получения помощи. Готовы помочь с дальнейшими вопросами!",24.474,3,5,5,5,5,5,5.0,"Ответ полностью отвечает на вопрос, предоставляет подробные шаги, дополнительную информацию и контактные данные. Информация соответствует указанным источникам, без выдумок. Текст ясен и хорошо структурирован."
32,"После регистрации в ЛК потребитель не может подать заявку. Кнопка ""Новый документ"" не активна. Действия заявителя.","Необходимо подождать пока данные пройдут проверку менеджером ЛК, это занимает не более 1 рабочего дня.","После регистрации в Личном кабинете заявитель может подать заявку только после того, как его персональные данные пройдут проверку менеджером ЛК. Пока проверка не завершена, кнопка **«Новый документ»** остаётся неактивной [1]. **Что делать заявителю:** 1. **Проверьте сообщения в разделе «Мои письма».** Если менеджер обнаружил расхождения в данных, он отправит письмо с темой «Личные данные пользователя не прошли проверку» и укажет, какие документы или сведения нужно исправить [3]. 2. **Исправьте некорректные данные.** Перейдите в раздел «Мои данные», нажмите кнопку «Изменить данные», внесите актуальные сведения (например, телефон, адрес, СНИЛС/ИНН) и прикрепите сканы правильных документов [2][3]. 3. **Отправьте исправления на проверку.** После нажатия «Изменить данные» менеджер проверит их в течение 1 рабочего дня. Пока проверка идёт, новые заявки добавить нельзя [2]. 4. **Ожидайте завершения проверки.** При успешной проверке в разделе «Мои документы» появится активная кнопка «Новый документ», и вы сможете выбрать нужный тип заявки [1]. 5. **Если после исправлений кнопка всё ещё не активна,** Свяжитесь с клиентским сервисом (тел.: 8‑800‑234‑77‑00) или посетите ближайший центр обслуживания (г. Уфа, ул. Комсомольская, 17) для уточнения статуса проверки и получения помощи [6]. **Дополнительные условия:** - Доступ к ЛК предоставляется только после ввода идентификационных данных, выданных в ЦОК или при очном обращении [5]. - При первом входе необходимо изменить временный пароль и указать адрес электронной почты [4]. Если понадобится помощь в заполнении «Мои данные» или в работе с «Мои письма», дайте знать – мы поможем!",17.798,6,5,5,5,5,4,4.8,"Ответ полностью отвечает на вопрос, описывая причину неактивности кнопки и конкретные действия заявителя. Информация представлена в виде чётко структурированных пунктов, что повышает полезность и ясность. Большая часть деталей согласуется с приведёнными источниками, однако некоторые элементы (например, телефон и адрес) могут не присутствовать в них, что слегка повышает риск галлюцинаций."
33,Потребитель не может войти в ЛК по логину и паролю выданному в ЦОК. Оператору необходимо выяснить как заявитель вводит логин и пароль. Как задать правильный вопрос?,Продиктуйте пожалуйста как вы вводите логин и пароль?,"**Какой вопрос следует задать потребителю** > «Вы вводите логин и пароль точно так же, как они указаны в СМС‑сообщении (или памятке), учитывая регистр, пробелы и все специальные символы? При этом вы используете компьютер, а не мобильный телефон, так как мобильная версия личного кабинета сейчас недоступна?» **Почему такой вопрос правильный** 1. В инструкциях указано, что логин и пароль необходимо вводить **в точности** так, как они указаны в полученном СМС‑сообщении или памятке, включая регистр и любые пробелы/знаки [1][2]. 2. Также отмечено, что в текущий момент **мобильная версия ЛК недоступна**, поэтому вход следует пытаться выполнить через компьютер [1]. **Пошаговая рекомендация оператору** 1. Спросите у потребителя, откуда он берёт логин и пароль (СМС, памятка, письмо). 2. Уточните, вводит ли он их **в точности** (без пропусков, с учётом регистра). 3. Поинтересуйтесь, на каком устройстве (ПК/ноутбук) он пытается войти. 4. Если потребитель использует мобильный телефон, предложите переключиться на компьютер 5. При необходимости напомните, что при первом входе требуется сменить временный пароль и указать e‑mail [2]. **Дополнительные условия / документы** - При вводе логина и пароля следует учитывать, что логин может быть СНИЛС, ИНН, ФИО и т.п., а пароль – случайно сгенерированный временный код [2]. - Если после уточнения проблема сохраняется, предложите потребителю воспользоваться функцией «Забыли пароль» или обратиться в центр обслуживания [1]. **Готовы помочь дальше** Если понадобится более детальная инструкция по восстановлению доступа, дайте знать – предоставим пошаговую схему.",24.5,2,5,5,5,5,5,5.0,"Ответ полностью соответствует запросу, предоставляя конкретный вопрос для оператора, обоснование, пошаговые рекомендации и ссылки на источники. Информация полностью соответствует документам, структура ясна и полезна."
34,Потребитель не может войти в ЛК. Оператору необходимо выяснить на каком сайте заявитель пробует авторизоваться. Как задать правильный вопрос?,"Продиктуйте пожалуйста название сайта, на котором вы пытаетесь пройти авторизацию?","**Какой вопрос задать оператору** Чтобы быстро понять, почему потребитель не может войти в ЛК, оператору следует уточнить, на каком сайте и по какой ссылке заявитель пытается авторизоваться. Правильный вопрос может звучать так: > «Вы пытаетесь войти в Личный кабинет потребителя услуг технологического присоединения на сайте ООО «Башкирэнерго» по адресу **https://www.bashkirenergo.ru/** (раздел «Потребителям» → «Личный кабинет потребителя услуг по технологическому присоединению»)? Если нет – укажите, пожалуйста, точный URL или название сайта, который Вы используете». **Почему такой вопрос важен** - В инструкциях указано, что ЛК размещён только на официальном сайте компании — **www.bashkirenergo.ru** [1][2]. - Одна из частых причин невозможности входа — попытка авторизации на неверном сайте [1]. - Уточнив URL, оператор сразу исключит ошибку «зашли не на тот сайт» и сможет перейти к проверке остальных возможных причин (пароль, регистрация, технические работы). **Пошаговая инструкция для оператора** 1. Спросите у потребителя точный адрес, который он вводит в браузере. 2. Сравните полученный URL с официальным — **https://www.bashkirenergo.ru/**. 3. Если URL отличается, объясните, что вход в ЛК возможен только через указанный сайт и предложите перейти по ссылке из пункта 2. 4. Если URL совпадает, переходите к проверке логина/пароля, наличию мобильной версии и статусу технических работ (см. причины в [1]). **Дополнительные условия / документы** - Официальный путь к ЛК описан в инструкции по работе в личном кабинете заявителя [2]. - При вводе логина и пароля необходимо учитывать точное написание, регистр и пробелы [1]. **Действуйте дальше** Если после уточнения сайта проблема сохраняется, предложите потребителю воспользоваться восстановлением пароля или обратиться в клиентский сервис 8‑800‑234‑77‑00 для дальнейшей помощи. Мы готовы помочь!",24.389,2,5,5,5,5,5,5.0,"Ответ полностью соответствует заданному вопросу, предлагает конкретную формулировку, объясняет её важность, даёт пошаговые рекомендации и опирается на указанные источники. Информация изложена ясно, структурировано и без вымышленных деталей, поэтому риск галлюцинаций минимален."
